Id,Link,Source,Titular,Copete,Cuerpo,Amarillismo,Falsa
31,https://elpais.com/elpais/2018/03/16/ciencia/1521223755_707491.html,El país,Un sistema de bajo coste de búsqueda de vida extraterrestre,"Científicos desarrollan un sistema de bajo coste para la búsqueda de vida extraterrestre, abriendo nuevas posibilidades en la exploración del universo","Un sistema de bajo coste de búsqueda de vida extraterrestre
 Un investigador plantea un método para buscar señales de tecnología alienígena entre los datos que recogen los satélites que buscan exoplanetas
 En un universo con *NUMBER* millones de galaxias con un número similar de soles en cada una, parece improbable que sea la Tierra el único mundo poblado por seres inteligentes. El cosmos está hecho con átomos que se comportan igual allá donde se encuentren y componen los mismos elementos químicos. Sin embargo, las dificultades para encontrarla son considerables. Las distancias hasta otras galaxias, incluso a algunas de las más cercanas, como Andrómeda, a *NUMBER* años luz de distancia, las hacen prácticamente inalcanzables. Tenemos que ceñirnos, por lo tanto, a una región cercana de nuestra galaxia.
 También es posible que se nos escapen algunos seres inteligentes que aún no hayan desarrollado la tecnología necesaria para captar nuestras señales de radio o enviárnoslas a nosotros, como pasaría si alguien hubiese tratado de comunicarse con los humanos inteligentes que ya habitaban la Tierra hace más de *NUMBER* años. Además, puede ser que las otras inteligencias no se comuniquen utilizando ondas electromagnéticas o simplemente sean algo tan extraño como el oceánico consciente que cubría el planeta Solaris en la novela de Stanislaw Lem.
 Asumiendo la dificultad de la tarea, Héctor Socas, investigador del Instituto Astrofísico de Canarias (IAC), acaba de publicar un artículo en el que propone un método para buscar señales de desarrollo tecnológico en otros sistemas solares. Héctor Socas propone analizar la información recogida por satélites como Kepler, encargado de una búsqueda masiva de planetas extrasolares, en busca de objetos en el cinturón de Clarke. Esta región, bautizada así en homenaje al escritor Arthur C. Clarke, que propuso el uso de la órbita geoestacionaria para telecomunicaciones, es una órbita circular de *NUMBER* kilómetros sobre el ecuador que ahora ocupan satélites como el Meteosat.
 En su trabajo, que se publica en The Astrohpysical Journal, muestra distintas simulaciones para determinar cuál sería la huella que dejarían sobre la luz de su estrella al pasar por delante de su planeta. En el texto también se explica cómo se podría distinguir un cinturón de satélites artificiales de anillos naturales como los que rodean Saturno. ""Esta búsqueda además sale gratis, porque se trataría de buscar otras cosas en los mismos datos que nos ofrecen los satélites que buscan exoplanetas"", afirma Socas.
 ""El trabajo se haría en dos fases, una primera fase de búsqueda y una de confirmación. Primero tienes misiones como Kepler que miran miles de estrellas. Una vez que tienes un candidato interesante, se trataría de dirigir hacia esa estrella telescopios muy potentes como el espacial James Webb [que se lanzará en *NUMBER*] o el Telescopio de Treinta Metros"", explica el investigador del IAC.
 Esta nueva generación de telescopios ayudará a resolver un misterio sobre los planetas extrasolares. De los que se han encontrado hasta ahora, solo uno de ellos tiene anillos, un supersaturno con unos anillos monstruosos que podrían ser en realidad la materia prima de una luna en formación. ""Esto puede ser porque la búsqueda de exoplanetas está muy centrada en planetas cercanos a su estrella y no más allá de la línea de hielo que, como sucede en el Sistema Solar, es donde se encuentran los planetas con anillos"", apunta Socas. En estos mundos, tampoco se ha encontrado de momento ninguna luna que los orbite.
 La dificultad de buscar lo que se quiere encontrar en el momento adecuado se plasma cuando se da la vuelta a la idea de Socas ""Si mirasen hacia nosotros desde otro planeta en busca de tecnología creada por vida inteligente, no verían nada"", indica. ""Al ritmo actual de ocupación de la órbita geoestacionaria seríamos detectables en el año *NUMBER*"", concluye.",Amarillista,Verdadera
32,https://hipertextual.com/2018/06/microsoft-adblocker-edge,Hipertextual,"Microsoft se suma a Apple e incluirá adblocker y ""antirrastreo"" en Edge","Microsoft anuncia que su navegador Edge incorporará un bloqueador de anuncios y funciones de antirrastreo, siguiendo los pasos de Apple para mejorar l privacidad del usuario.","Microsoft se suma a Apple e incluirá adblocker y ""antirrastreo"" en Edge
 Microsoft se suma a Apple para proteger la privacidad de los usuarios e incluirá bloqueadores de contenido en su navegador Edge para iOS y Android.
 Parece que todos van contra Google, pero lo cierto es que al final es su negocio. Desde que Apple anunciase los planes de introducir sistemas antirrastreo en el navegador Safari de iOS y abrir la puerta a los bloqueadores de anuncios dentro de su tienda de aplicaciones las cosas han cambiado en el panorama móvil. Y está próximos a endurecerse con las nuevas medidas que plantea con la llegada de iOS *NUMBER* y Mojave.
 No obstante, hasta ahora Apple estaba sola en esta lucha contra los anuncios intrusivos y el rastreo de usuarios, al menos en los que se refiere a las grandes compañías. Sí, Android incluye una buena lista de bloqueadores en sus tiendas, y muchos de ellos son capaces de eliminar los rastreadores a nivel del sistema (incluyendo en apps de terceros), pero por defecto el asunto sigue en manos de Google y no todos los usuarios utilizan estas herramientas.
 Lógicamente, Google no va a potenciar esta industria. Si bien ha colaborado con algunas compañías de adblockers para lo que se llaman ""anuncios aceptables"", pero como viene siendo lógico el grueso del modelo de negocio de Google es la publicidad. Ahora las cosas van a complicarse un poco para la compañía, y decimos un poco porque el siguiente movimiento de Microsoft va a aumentar la leña a esta lucha entre la publicidad responsable, invasiva y el rastreo de los usuarios.
 Y es que Microsoft ha confirmado que su navegador Edge para iOS y Android va a incluir de serie un bloqueador de publicidad activado por defecto. Si bien la cuota del navegados es complicado que haga sombra a Chrome en Android o Safari en iOS, si que pone de manifiesto otra gran compañía, junto con Mozilla, que se suma al bloqueo de contenidos del lado de usuario activado por defecto.
 Chrome para el escritorio activó recientemente un bloqueado de anuncios, controlado por Google pero que está muy lejos de lo que hacen los grandes adblockers. La duda es si a corto plazo se instalará en toda plataforma mayoritaria este movimiento, obligando a cambiar diametralmente la publicidad que ven los usuarios en la red.",No Amarillista,Verdadera
33,http://www.elruinaversal.com/2018/04/11/hi5-vuelve-a-convertirse-en-la-red-social-mas-popular-tras-escandalo-de-facebook-por-vender-datos/,El Ruinaversal,HI5 VUELVE A CONVERTIRSE EN LA RED SOCIAL MÁS POPULAR TRAS ESCÁNDALO DE FACEBOOK POR VENDER DATOS,"Hi5 resurge como la red social más popular después del escándalo de Facebook por la venta de datos de usuarios, captando la atención de quienes buscan alternativas más segura.","HI5 VUELVE A CONVERTIRSE EN LA RED SOCIAL MÁS POPULAR TRAS ESCÁNDALO DE FACEBOOK POR VENDER DATOS
 México.- Una fuerte sorpresa y emoción experimentan el dueño de la red social HI5, Andrew Scott, al percatarse que de la noche a la mañana la popularidad de su página aumentó un *NUMBER*%, al grado de que como lo era hace más de *NUMBER* años, nuevamente ha vuelto a convertirse en la red social favoritas de las personas en el mundo.
 Andrew menciona que con la llegada de Facebook se resignaron a que su página quedaría en el olvido aún y cuando alguna vez fue la red social más popular del mundo:
 ""Fuimos la primera red social viral, sin embargo a la gente no le gustó que permitiéramos poner gifs, canciones, videos y un sinfín de cosas que solo hacían que las paginas se trataban cuando alguien ingresaba sesión. Sin embargo seguíamos firmes, ni siquiera MySpace logró desbancarnos, fue hasta que llegó Facebook que vimos nuestra inminente muerte.
 Era obvio que ya no éramos los reyes, por eso solo decidimos enfocarnos en el país que todavía nos apreciaba, que es China y otros pocos, y cuidar ese mercado. Definitivamente fue una sorpresa muy grande percatarnos que de un día para otro habíamos recuperados las miles de millones de visitas que teníamos duramente, fue una locura, no sabíamos que pasaba"", comentó el dueño mientras se revolcaba en sus nuevos millones.
 Según comenta un estudio, millones de personas decidieron dejar Facebook tras el escándalo de Cambridge Analytica, donde se acusó a su dueño Mark Zuckerberg de permitir la venta de datos privados, situación que hizo que las personas estallan en ira y regresaran a HI5 solo por venganza:
 ""Acepto que no leí las letras chiquitas pero de ahí a que Zucaritas (sic) este vendiendo nuestros datos es muy diferente. Es verdad que yo informó hasta cuando voy al baño y tengo mi perfil libre para que mis enemigas vean mis cosas y se mueran de la envidia, pero eso no significa que tienen derecho a capturar lo que hago para convencernos de votar por alguien.
 No es justo que anden de fisgones viendo que nos gusta para a fuerzas obligarnos a votar por Meade, que es el que más me sale en mi perfil"", comentó una mujer que sube foto de hasta las enchiladas que se está comiendo.
 Según varios medios, aunque e todos saben que hi5 es incluso menos privado que Facebook decidieron mudarse por el coraje hacia Facebook: ""fue una sorpresa abrir mi cuenta de HI5 y ver fotos mías de cuando tenia *NUMBER* años, ni me veo tan cambiado ahora que tengo *NUMBER*, lo que si esta un poco cambiado es el HI5, sigue la misma modalidad de saber quien visitó tu perfil y como no le entiendo no puedo cambiar la privacidad para ocultar todo.
 Yo sé que la gente puede enterarse más fácilmente de mis datos en HI5 porque no tiene tanta seguridad, pero por lo menos ellos no fingen que protegen mi información. Ya leí los términos de HI5 que son solo *NUMBER* renglones, y solo mencionan que ellos no tienen sistema de seguridad, por lo menos son sinceros"", comentó un usuario.
 Según varios medios, el HI5 incluso ha colapsado ya que entre los videos, animaciones y gifs, más la llegada de los millones de usuarios que otra vez iniciaron sesión después de años, la página tarda entre *NUMBER* y *NUMBER* minutos en cargar, sin embargo esto no les importa a los usuarios que estan dispuestos a hacer el sacrifico con tal de ver hundido a Mark por violar su privacidad.",Amarillista,Falsa
34,https://www.laparadadigital.com/abren-sitio-web-con-informacion-de-espacios-en-guarderias-del-imss-en-juarez/,La Parada Digital,Abren sitio web con información de espacios en guarderías del IMSS en Juárez,"El IMSS lanza un sitio web que proporciona información actualizada sobre los espacios disponibles en guarderías en Juárez, facilitando el acceso a servicios para las familias","Abren sitio web con información de espacios en guarderías del IMSS en Juárez
 Juárez.- A partir de la colaboración de las dependencias que integran la Mesa de Trabajo sobre los Derechos Humanos y Laborales de las Mujeres en Ciudad Juárez, se creó una plataforma virtual para conocer los espacios disponibles y ubicación de las guarderías del Instituto Mexicano del Seguro Social (IMSS), a fin de facilitar a las familias juarenses el acceso a este servicio de cuidado infantil.
 La asociación civil Desarrollo Económico de Ciudad Juárez, en coordinación con el IMSS, desarrollaron un portal en línea en donde se presenta el directorio de guarderías con los espacios disponibles por sala, para que las madres y padres de familia conozcan cuál es la más accesible según su ruta de la casa al trabajo y viceversa.
 La coordinadora de proyectos de Desarrollo Económico A.C, Claudia Ochoa, indicó que esta página se actualizará los días quince de cada mes con la información que el IMSS proporcione.
 Ochoa agregó que el portal también permite la inscripción en línea, al dar click en el mapa para conocer la dirección de la guardería.
 Actualmente, el IMSS registra en las *NUMBER* estancias de cuidado infantil ubicadas en Ciudad Juárez, mil *NUMBER* espacios disponibles, es decir, el *NUMBER* por ciento de la ocupación total.
 Por ello se busca que las familias juarenses que cuentan con esta prestación, aprovechen estos espacios gratuitos para el cuidado de sus hijas e hijos desde los *NUMBER* días a cuatro años de edad, en donde incluso se imparte el primer año de preescolar desde el *NUMBER*.
 Las y los interesados pueden acceder a esta información a través de la siguiente liga: *URL*-guarderias-imss/.",No Amarillista,Verdadera
35,https://www.eldizque.com/imss-se-moderniza-adquiere-computadoras-commodore-64/,El Dizque,El IMSS se moderniza: Adquiere computadoras Commodore *NUMBER* a precio de ganga,"En un esfuerzo por modernizarse, el IMSS adquiere un lote de computadoras Commodore a un precio de ganga, actualizando sus equipos tecnológicos","El IMSS se moderniza: Adquiere computadoras Commodore *NUMBER* a precio de ganga
 Con el fin de agilizar aún más el sistema de administración del Instituto Mexicano del Seguro Social, la dependencia adquirió dos millares de computadoras Commodore *NUMBER*, que serán instaladas en las principales clínicas y hospitales de todo el país. Con estas máquinas se pretende hacer la captura de todas las historias clínicas, las cuales serán almacenadas en discos de *NUMBER* *NUMBER*/*NUMBER*, de manera que sea más práctico el manejo de los datos.
 ""Pudimos adquirir todo el equipo realmente a precio de ganga"", declaró en rueda de prensa José Antonio González Anaya, Director General del IMMS. ""Con el gasto que hicimos al adquirir estas dos mil unidades, apenas podríamos haber comprado como veinte o treinta computadoras modernas, y no le vimos el caso"".
 De acuerdo a González Anaya, el ahorro fue sin precedentes, pues al comprar cada unidad en *NUMBER* dólares, solamente gastaron *NUMBER* mil dólares. ""De haberlas comprado cuando salieron a la venta, hace poquito, en *NUMBER*, nos habríamos gastado *NUMBER* millones de dólares, porque su precio de lanzamiento fue de *NUMBER* dólares. Afortunadamente decidimos esperarnos"", externó.
 — ¿Y ya incluyen el floppy drive?
 — No sé qué sea eso, pero digamos que sí.
 — ¿Y quiénes las operarán?
 — En una muestra de política acorde con la austeridad que ha propuesto el gobierno del ciudadano presidente Enrique Peña Nieto, las Commodore *NUMBER* serán operadas por los médicos internistas de cada hospital, y así no tendremos que gastar en sueldos… Sólo en su capacitación.
 Para dicha capacitación, el IMSS pagará *NUMBER* millones de dólares a la novel compañía (aparentemente japonesa) Nozoide Inojo Zakantú, a fin de que impartan cursos a los internistas que se encargarán de manejar las computadoras.
 Se espera que la captura de los historiales clínicos esté lista antes de *NUMBER*. Una vez concluida, todos los trámites se verán agilizados y el Instituto Mexicano del Seguro Social dará un mejor servicio.
 ""Vamos a matar dos pájaros de un tiro"", dijo González Anaya. ""Todas las tarjetas perforadas y los archivos en papel que tenemos hasta ahora podrán recibir otros usos, como vendas, gasas y cosas así"", concluyó.",No Amarillista,Falsa
36,https://elpais.com/sociedad/2012/08/21/actualidad/1345575433_586453.html,El País,Al rescate del laboratorio de Tesla,"Un proyecto ambicioso busca rescatar y restaurar el laboratorio original de Nikola Tesla, preservando su legado y contribuciones a la ciencia yla tecnología.","Al rescate del laboratorio de Tesla
 Una iniciativa popular ha recaudado ya más de *NUMBER* euros para comprar el edificio donde trabajó el inventor.
 El futuro museo en Estados Unidos sobre la vida y obra de Nikola Tesla, científico e inventor de la corriente alterna, parece más posible que nunca. Y eso, gracias a los más de *NUMBER* donantes que, en menos de una semana y a cambio de diferentes recompensas, han contribuido con más de *NUMBER* dólares (unos *NUMBER* euros) a través de la web de crowdfunding Indiegogo.com (la mayor plataforma a nivel mundial de cooperación colectiva llevada a cabo por personas que promueven una iniciativa para conseguir dinero u otros recursos, con el fin de financiar esfuerzos e iniciativas de otras personas u organizaciones). Esta iniciativa de crowdfunding, promovida bajo el lema Vamos a construir un maldito museo para Tesla, se marcó el pasado *NUMBER* de agosto un objetivo final de *NUMBER* dólares, aunque todo parece indicar que para cuando finalice el plazo, el *NUMBER* de septiembre, habrán superado con creces tal cantidad. Ayer, esta campaña era la número uno en cuanto a recaudación de fondos en dicha página de Internet, superando a la llevada a cabo el pasado mes de junio para ayudar a una monitora de autobús acosada por varios alumnos, que consiguió *NUMBER* dólares, una de las más exitosas en EE UU hasta que Tesla y su museo han entrado en juego.
 ""Estamos intentando conseguir el dinero suficiente para comprar el viejo laboratorio de este inventor, conocido como Wardenclyffe Tower, situado en el Estado de Nueva York, y así poder abrir un museo con sus investigaciones y estudios"", asegura la artífice de la exitosa campaña, la ONG Tesla Science Center, un equipo de ocho personas que incluye físicos, algún educador, un experto geólogo, un geógrafo y el librero Matthew Inman, creador del cómic The Oatmeal. El espacio se encuentra a la venta en la actualidad y a punto de ser adquirido por *NUMBER* millones de dólares para la construcción de locales comerciales. Este hecho llevó a la plataforma a defender este recinto como un monumento histórico. ""Tesla Science Center es una organización sin ánimo de lucro que lleva más de una década luchando por proteger esta propiedad. Lo más importante es que el lugar esté en las mejores manos"", asegura Inman en su blog.
 El laboratorio cerró en *NUMBER* cuando el investigador se arruinó
 Tesla, físico nacido en Croacia en *NUMBER* en el seno de una familia serbia y nacionalizado estadounidense en *NUMBER*, dominó disciplinas tales como la física, las matemáticas y la ingeniería eléctrica. Es uno de los fundadores de la industria eléctrica. También fue el inventor de la radio —en los años setenta el Tribunal Supremo de EE UU dictaminó que la patente relativa a este invento era legítimamente propiedad de Tesla, y no de Marconi—, del altavoz, de la luz de neón, del control remoto o del alternador, entre otros. Algunas de sus invenciones llegaron a rozar el disparate, como su teoría sobre el rayo de la muerte —un arma de *NUMBER* millones de voltios, muerte y exterminio a *NUMBER* kilómetros de distancia— o su idea de transmitir energía inalámbrica. Su mala gestión financiera le llevó a morir arruinado en *NUMBER*.
 Los fondos recaudados harán así que el viejo laboratorio donde trabajaba Tesla, fundado en *NUMBER* y donde el afamado inventor quiso desarrollar una torre que proporcionara electricidad inalámbrica a todo el mundo, pueda renacer de sus cenizas.
 Los propietarios piden *NUMBER* millones de euros por el terreno
 La falta de fondos hizo que el proyecto de Tesla se interrumpiera en *NUMBER*, y la propiedad donde se asentaba su laboratorio fue vendida a un fabricante de películas. Aunque la torre de *NUMBER* metros fue demolida, el laboratorio y las instalaciones que había debajo han permanecido intactas hasta hoy, ha asegurado Inman.
 ""No existe ningún museo sobre este científico e inventor en EE UU, y conseguir este objetivo aseguraría que sus investigaciones permanecerían protegidas en lo que se denominaría Centro Científico de Nikola Tesla"", sostiene Inman. La adquisición total del espacio, valorado en unos *NUMBER* millones de dólares, parece más al alcance de la mano gracias a los *NUMBER* dólares que esperan recaudar —quizá con creces— con esta campaña y a la aportación de la misma cantidad por parte del Estado de Nueva York.
 Además de la colecta a través de Internet, Inman ha hecho un llamamiento a grandes empresas para que formen parte del proyecto. Se ha dirigido a Google, Tesla Motors y J. P. Morgan, entre otros. Porque, si finalmente se logra adquirir la propiedad, luego se necesitará más dinero para convertir el lugar en un museo. ""Los *NUMBER* millones solo nos dan para el terreno"", dice Inman. Uno de los que han dado un paso al frente ha sido Elon Musk, creador de PayPal y fundador de Tesla Motors, aunque todavía no se ha hecho pública la cantidad que donará.",Amarillista,Verdadera
37,https://www.eldizque.com/el-fbi-revela-como-logro-desencriptar-el-iphone-de-un-terrorista-sin-la-ayuda-de-apple/,El Dizque,El FBI revela cómo logró desencriptar el iPhone de un terrorista sin la ayuda de Apple,"El FBI revela las técnicas utilizadas para desencriptar el iPhone de un terrorista sin la cooperación de Apple, generando un debate sobre la privacidad y la eguridad digital.","El FBI revela cómo logró desencriptar el iPhone de un terrorista sin la ayuda de Apple
 El FBI logró acceder al iPhone que usó uno de los atacantes del acto terrorista en San Bernardino, California, ocurrido el *NUMBER* de diciembre de *NUMBER*, informó el Departamento de Justicia de Estados Unidos.
 Hasta ahora no se sabía cómo el FBI pudo acceder al teléfono celular usado por Syed Farook sin la ayuda de Apple. El Gobierno de Estados Unidos había tratado de forzar a la compañía a desencriptar el teléfono, obteniendo una negativa para ayudar en la investigación, alegando que deben proteger los datos de sus usuarios.
 Sin embargo, antes de la audiencia en la corte donde se trataba de obtener una orden para ello, el FBI anunció que ya no era necesaria la ayuda.
 Como era de esperarse, este anuncio ha sorprendido a Apple, pues ha dejado ver que existe una manera para violar la seguridad de sus dispositivos.
 ""No fue fácil, señores"", señaló en rueda de prensa James Comey, Director del FBI. ""Lo primero que hicimos fue recurrir a nuestros más calificados ingenieros, pero estos se vieron superados por la tecnología de Apple, pues llegaron a un punto en que había peligro de que el dispositivo explotara junto con todos los datos ahí contenidos, por lo que decidieron ya no continuar con sus intentos"".
 El FBI, entonces, pidió apoyo a expertos de la CIA y del Tecnológico de Massachusetts; sin embargo, ninguno de ellos tuvo la capacidad para violentar la seguridad del aparato.
 ""Cuando todo parecía perdido —continuó Comey—, un agente infiltrado en México fue el que dio la solución al problema. Le mandamos el iPhone y se dirigió a la zona de Eje Central en la Ciudad de México, donde por *NUMBER* pesos y en cosa de *NUMBER* minutos, no sólo le habían desencriptado el aparato, sino que le habían vaciado la información a un USB y aprovecharon para sopletearlo y hacerle limpieza"".
 Se sabe que ahora Apple está buscando a los responsables de esto, para que les digan cómo le hicieron.",Amarillista,Falsa
38,https://www.merca20.com/phone-el-dispositivo-para-los-adictos-traer-el-telefono-en-la-mano/,Merca2.0,"NO PHONE: EL ""DISPOSITIVO"" QUE NO HACE NADA PARA LOS ADICTOS A TRAER EL TELÉFONO EN LA MANO","Llega No Phone, un dispositivo que no hace nada, diseñado para ayudar a las personas adictas a llevar siempre un teléfono en la mano, promoviendo un estilo de vida más desconctado.","NO PHONE: EL ""DISPOSITIVO"" QUE NO HACE NADA PARA LOS ADICTOS A TRAER EL TELÉFONO EN LA MANO
 Internacional.- En el sitio de financiamiento colectivo Kickstarter encontramos proyectos muy interesantes como el hoverboard o algunos totalmente inútiles como aquella famosa ensalada de papa. Ahora te mostramos el No Phone, un ""dispositivo"" que no hace nada pero te ayuda a vivir con tu adicción al móvil. Ya recaudó *NUMBER* mil dólares. Además, te decimos datos relevantes sobre los smartphones en el mundo.
 Para finales de este año, se espera que *NUMBER* mil *NUMBER* millones de personas en el mundo utilicen teléfonos móviles, de acuerdo con estimaciones de eMarketer. En el caso de los smartphones , hasta septiembre de este año, el *NUMBER* por ciento son hechos por Samsung, el *NUMBER* por ciento son fabricados por Apple y el *NUMBER* por ciento son de la marca Nokia.
 Es tan grande el número de usuarios de gadgets que algunos generan adicción a estos. El caso más reciente fue el reporte del primer caso de adicción a Google Glass, pero desde antes existen miles de casos de adictos al teléfono.
 Para todos esos adictos a traer el teléfono en la mano se creó un proyecto en Kickstarter que ofrece una alternativa libre de tecnología. Se trata del No Phone, un ""dispositivo"" que puedes traer en la mano pero que no te distraerá en conciertos, cines ni te hará que choques cuando camines por la banqueta.
 Algunas de las características del No Phone:
 No usa batería
 No necesita actualizaciones
 A prueba de golpes
 A prueba de agua
 No tiene cámara
 No tiene bluetooth
 No hace llamadas
 No se dobla
 Este divertido producto parodia es real y se puso una meta de *NUMBER* mil dólares en Kickstarter pero hasta el momento ha recaudado cerca de *NUMBER* mil dólares. Además, ofrece una versión que permite hacer selfies.",No Amarillista,Verdadera
