Id,Link,Source,Titular,Copete,Cuerpo,Amarillismo,Falsa
45,http://www.bbc.com/mundo/noticias/2016/03/160329_tecnologia_fbi_como_desbloqueo_iphone_san_bernardino_apple_ch,BBC News,¿Cómo logró el FBI desbloquear el iPhone del atacante de San Bernardino y de paso frustrar a Apple?,"El FBI revela las estrategias que utilizó para desbloquear el iPhone del atacante de San Bernardino, dejando a Apple frustrada y preocupada por la seguridad de sus dispositivos","¿Cómo logró el FBI desbloquear el iPhone del atacante de San Bernardino y de paso frustrar a Apple?
 Tomó varias semanas, órdenes judiciales, contrademandas, pero finalmente el Buró Federal de Investigación de Estados Unidos (FBI, según sus siglas en inglés) logró penetrar el iPhone del atacante de San Bernardino.
 ""Hemos logrado acceder exitosamente a la información guardada en el iPhone de (Syed) Farook"", señaló el Departamento de Justicia de EE.UU. en la petición en la que pide terminar con el proceso legal que había iniciado contra Apple.
 ""Ya no requerimos la ayuda de Apple"", aseguró el escrito.
 Así puso fin a la pelea de seis semanas desde que el FBI le pidiera a Apple desarrollar una ""llave maestra"" o ""superclave"" para acceder a la información contenida en el iPhone de Farook, quien junto a su mujer mató a *NUMBER* personas en un tiroteo en San Bernardino, California.
 Apple se negó, argumentando que eso vulneraba la privacidad de sus usuarios, ya que una llave maestra puede utilizarse en cualquier dispositivo.
 Pero la acción, lejos de finalizar el debate, le echó leña, haciendo surgir una serie de preguntas sobre las herramientas utilizadas y el futuro de la privacidad de los datos contenidos en dispositivos móviles.
 ¿Cómo accedió el FBI a la información?
 Hasta el momento, no se saben los detalles técnicos. Y es poco probable que se sepan oficialmente. No hay nada que obligue al FBI a revelar su fórmula.
 Lo que se sabe es que lo hizo a través de una ""tercera parte"". Es decir, una compañía externa.
 En lo que coinciden analistas y miembros de la industria es en que es prácticamente imposible que otra compañía haya podido proveer la llave maestra o ""superclave"" para vulnerar el sistema de seguridad iOS de Apple.
 ""Que hayan logrado desencriptar y encriptar (el sistema operativo) es posible pero lo menos probable"", le comenta a BBC Mundo David Gibson, vicepresidente de Estrategia y Desarrollo de Mercados de Varonis.
 Lo más probable, según el experto, es que haya sido un ""ataque de software"".
 Esto a través de una empresa de desbloqueo de información, o lo que en la industria se denomina Análisis Forense de teléfonos celulares.
 No es lo mismo que el común ""desbloqueo"" de un iPhone que puede realizar una empresa telefónica o un proveedor ""pirata"". Ese desbloqueo lo que hace es volver el iPhone a su estado original, es decir, borrando toda la información existente.
 Lo que hacen las empresas de Análisis Forense es ""desbloquear"" el aparato precisamente para recuperar la información contenida en él.
 Según Jerónimo García, director de la consultora en servicios informáticos Sidertia Solutions, la manera más lógica sería es que hayan usado un ""exploit"" (herramienta de software diseñada para aprovecharse de una falla en un sistema informático) que explote una vulnerabilidad en el gestor de arranque de IOS, iBoot, encargado de cargar el modo de recuperación.
 Así, ""se podría tomar el control del mismo y por tanto poder evitar la limitación de la contraseña"", le asegura el director a BBC Mundo.
 Otra posible forma de desbloquearlo sin perder la información es clonar una ""imagen"" del teléfono, es decir, una copia física del dispositivo para probar contraseñas incluso cuando se sobrepasa el límite de intentos.
 ""Obtienes una imagen lógica y vas rastreando con ella"".
 Así, al bloquearse el teléfono luego de *NUMBER* intentos, se puede ""continuar el ataque con alguna de las copias de la imagen"".
 ¿Quién desafió a Apple y ayudó al FBI?
 El FBI no quiso identificar la ""tercera parte"" que logró acceder a la información y, según lo que le dijo su oficina central de Comunicaciones a BBC Mundo, tampoco lo hará.
 Pero todos los ojos están puestos en Cellebrite, una compañía de origen israelí con oficinas en distintas partes del mundo, entre ellas EE.UU., luego de que el periódico israelí Yedioth Ahronoth revelara el miércoles pasado el supuesto vínculo.
 Cellebrite le confirmó a la BBC que trabajan con el FBI, pero no quiso dar detalles.
 Sin embargo, según los detalles este tendría relación con la ""renovación del software UFED para siete máquinas"" en Chicago.
 BBC Mundo intentó obtener más detalles del contrato, sin embargo hasta el cierre de este artículo el FBI no contestó el requerimiento.
 El mismo *NUMBER* de marzo el FBI aseguró que trabajaba con una""parte externa"", que había desarrollado una forma de quebrantar la seguridad del iPhone de San Bernardino.
 ¿Se abrió una caja de Pandora?
 La pregunta hoy, aseguran los expertos, no es quién lo hizo, sino si esta es o no una solución definitiva que zanje salomónicamente conflictos como el que ocurrió entre Apple y el FBI, entre el derecho a la privacidad de los datos y la seguridad nacional.
 ""Hoy es Apple, pero podría ser cualquier otro"", le dice a BBC Mundo Joel Bollo, director ejecutivo de la compañía sueca de análisis forense de datos MSAB, una de las principales competidoras de Cellebrite.
 ""El principal tema ahora es cómo mantener nuestros teléfonos seguros, prevenir la vigilancia masiva y al mismo tiempo cumplir con los requerimientos necesarios para mantener el bien común"", explica Bollo, quien se autodenomina enemigo de la cibervigilancia masiva.
 ""Tenemos muchos clientes. El FBI es uno de ellos"", explica su director ejecutivo al ser consultado.
 La empresa creó un sistema denominado Tecnología de Acceso a Control Forense (FACT, según sus siglas en inglés) que puede ser utilizado en futuros casos como el del iPhone de San Bernardino.
 El sistema se vende como una tercera vía para los casos donde, como en San Bernardino, los organismos de inteligencia y seguridad nacional requieran acceso a la información sin tener que crear una ""llave maestra"" que vulnere la seguridad y la privacidad del resto de los usuarios.
 El método utiliza pares distintos de claves para encriptar y desencriptar información. Es decir, además de contar físicamente con el dispositivo hay que tener dos pares de llaves -o claves-: uno generado por la agencia gubernamental que requiere la información y otra por la empresa que hace el dispositivo.
 La clave utilizada para cada caso específico que requiera la ley se puede configurar para un número finito (normalmente de *NUMBER* a *NUMBER*) de usos, luego de los cuales queda inválida.
 Además, sólo con ambos pares de claves se pueden extraer los datos desde el dispositivo móvil.
 ¿Se sabrá algún día cómo obtuvo el FBI la información?
 Apple anunció que hará todo lo posible para que el FBI revele cómo logró acceder a la información.
 Sin embargo, lo más probable es que no pase.
 ""Es difícil que el FBI haga pública la metodología"", explica García, ya que ""es muy probable que la utilicen en futuros casos"".
 Probablemente, tampoco revelará oficialmente el nombre de la compañía externa.
 La ley en EE.UU. permite a las autoridades retener la fuente de información si se les suministra de forma confidencial, y proteger las metodologías de recolección de datos sensibles de inteligencia.
 ¿Cómo evitar que tu iPhone sea vigilado?
 Lo primero que hay que tener claro es que no hay tecnología a prueba de fallos.
 ""Es poco realista pensar que un aparato que guarda información, ya sea un celular inteligente u otro, es infranqueable"", asegura Gibson.
 Sin embargo, que un tercero haya desarrollado una metodología que aproveche una debilidad ""abrirá un debate nada agradable para Apple"", asegura García.
 Una de las grandes ventajas que Apple explota en términos de marketing es la de la seguridad en privacidad de sus dispositivos.
 ""Si el FBI ha aprovechado algún fallo en el hardware del dispositivo, el problema para Apple es altamente complejo ya que obligaría al cambio de dispositivo, o a que los usuarios asumieran el riesgo"", comenta García.
 ""En el caso de que el fallo fuera lógico, si es identificado por Apple, tal y como en otras tantas ocasiones, una nueva versión de iOS solventaría el problema"".
 Es lo que hace Apple cada vez que detecta una metodología para desafiar la seguridad de su sistema operativo.
 La última actualización del iOS fue lanzada por Apple fue el *NUMBER* de marzo.",Amarillista,Verdadera
46,http://www.eluniversal.com.mx/techbit/por-que-motivos-puede-explotar-un-celular,El Universal,¿Por qué motivos puede explotar un celular?,"Expertos explican las diversas razones por las que un celular puede explotar, destacando los riesgos y las precauciones necesarias para evitar accidentes","¿Por qué motivos puede explotar un celular?
 Las baterías no sólo explotan por defectos de fábrica, el uso que le damos al equipo tiene mucho que ver
 No sólo los teléfonos caros explotan.
 Los casos de personas a quienes el celular les ha explotado no son pocos, es bien sabido que varias marcas de smartphones han tenido que retirar su producto del mercado luego de que estos hayan tenido fallas. Aunque en estas situaciones se culpa al fabricante, lo cierto es que hay factores en que nosotros, como consumidores y dueños, jugamos un papel importante para evitar que esto suceda. Cualquier celular puede explotar, pues todos trabajan con una batería recargable. En la actualidad, las baterías que más se utilizan son las de iones de litio -un material inflamable-. Golpear la batería fuertemente puede provocar un corto circuito, eventualmente, esto hará que estalle. Así que una caída puede terminar en accidente inflamable. Otro factor que causa cortos circuitos son los ciclos de carga inconsistentes, pues facilitan la formación de dendritas, filamentos que pueden extenderse a lo largo de la pila y dañar su composición.",No Amarillista,Verdadera
47,https://www.huffingtonpost.com/entry/scientists-address-chemtrail-theory_us_57b3a14ee4b0edfa80da2ffc,HUFFPOST,Esto es lo que los científicos realmente piensan sobre 'Chemtrails',"Científicos desmienten los mitos sobre los 'Chemtrails', proporcionando información basada en evidencia sobre estos fenómenos y su impacto real en el clia.","Esto es lo que los científicos realmente piensan sobre 'Chemtrails'
 La próxima vez que piense en esas rayas blancas, parecidas a nubes, pintadas en el cielo, recuerde este papel recién publicado antes de susurrar desdeñosamente a usted mismo, "" chemtrails ... ""
 En el primer estudio de este tipo revisado por pares , investigadores de la Universidad de California, Irvine y la Carnegie Institution for Science descubrieron que los principales científicos atmosféricos del mundo creen abrumadoramente que los rastros de condensación , conocidos en la comunidad científica como ""contrails"" y la conspiración los teóricos como ""estelas químicas"" - no son el producto de un programa financiado por el gobierno cuyo objetivo es rociar secretamente sustancias químicas en la atmósfera para controlar todo, desde la superpoblación hasta el suministro de alimentos.
 Sus resultados fueron publicados la semana pasada en la revista Environmental Research Letters y proporcionan una fuente autorizada muy necesaria sobre esta extendida teoría de la conspiración, según Steven J. Davis , coautor del estudio y profesor de ciencia del sistema terrestre en la UCI.
 ""No estamos tratando de cambiar las mentes de los trileros de chemtrail"", dijo Davis a The Huffington Post.
 ""Hay personas inteligentes que no están convencidas de una u otra manera [con respecto a la teoría de la conspiración del chemtrail]"", agregó. ""Cuando van a Google, no queremos que encuentren solo sitios web de teóricos de la conspiración, queremos que tengan alguna perspectiva científica"".
 Los autores del estudio creen que este es el primer artículo científico revisado por pares que evalúa las afirmaciones hechas por los llamados cheques chemtrail y proporciona pruebas de que la mayoría de los científicos de la vida real simplemente no están comprando sus teorías.
 Los investigadores señalan que un estudio de *NUMBER* reveló que casi el *NUMBER* por ciento de los encuestados creía que al menos en parte era cierto que las rayas en el cielo dejadas por los aviones son en realidad intentos del gobierno de rociar secretamente sustancias químicas nocivas en la atmósfera. Para evaluar las afirmaciones de Truthers, los investigadores encuestó a los químicos atmosféricos y geoquímicos para preguntar si alguna vez habían encontrado evidencia que apunta a programas de pulverización atmosférica a gran escala secretos, que los investigadores llaman SLAP. De los *NUMBER* científicos que respondieron, todos menos uno dijeron ""no"".
 El único investigador que había dicho ""sí"" informó haber observado altos niveles de bario en un área que normalmente tiene niveles bajos del elemento en el suelo. En una entrevista de seguimiento, los investigadores encontraron que este experto simplemente no descartaba la posibilidad de una operación encubierta del gobierno en el ámbito de posibles explicaciones (de las cuales hay muchas), según Davis.
 ""Es bastante flexible decir que esta persona en realidad estaba apoyando este tipo de conspiración"", dijo Davis a HuffPost. ""Era más que no podían excluirlo"". Los investigadores también pidieron a los expertos que brinden una explicación científica de algunas de las pruebas que chemtrail truthers cita para respaldar sus teorías, incluidas fotos de estelas y copias de análisis de laboratorio que, según los teóricos, muestran indicios de fumigación química.
 ""Hemos tomado la evidencia de que [chemtrail Truthers] proporcionó en sus sitios web lo mejor que pudimos encontrar"", explicó Davis. Luego, ""tuvimos expertos que pesan sobre las explicaciones más simples para esas cosas"".
 Los resultados fueron bastante concluyentes: los científicos encuestados pudieron dar explicaciones científicas razonables para la evidencia de los teóricos de la conspiración.
 A Davis le sorprendió que los expertos de diferentes disciplinas pudieran dar explicaciones relativamente similares, ""teniendo en cuenta que estamos pidiendo a una gran diversidad de expertos que miren las fotos y vean lo que está sucediendo"".
 ""Los expertos pudieron ver estas fotos y encontrar explicaciones bastante sencillas basadas en la química y la física"", dijo.
 Los autores del estudio dejan en claro que son conscientes de que este documento científico probablemente contribuirá poco a desalentar a los teóricos del chemtrail .
 Como señala The New York Times, ha habido razones legítimas para la pulverización atmosférica , como inducir artificialmente la lluvia a través de la ""siembra de nubes"" y explorar la fumigación química como una forma de combatir el calentamiento global. Sin embargo, como lo demuestra este estudio, casi todos los científicos encuestados no han observado ninguna evidencia de programas secretos de aspersión a gran escala en la atmósfera.
 ""No estamos afirmando que esto definitivamente anula la teoría de la conspiración"", dijo Davis a HuffPost. ""Más bien, este es solo el primer paso para obtener algo en el registro científico que las personas poco convencidas pueden buscar en Google y encontrar algo científico"". Hay mucho más trabajo que se puede hacer sobre este tema "".
 Al abordar estas teorías de chemtrail, los investigadores esperan que las personas consideren la opinión científica real, no solo los sitios web de la teoría de la conspiración, y lleguen a sus propias conclusiones. Y esperan inspirar a la comunidad científica a hacer más investigaciones para desacreditar los reclamos de chemtrail.
 ""Nuestro trabajo por lo menos comenzaría un registro científico sobre el tema"", dijo Davis. ""Uno sobre el que esperamos que otros se basen"".",Amarillista,Verdadera
48,https://expansion.mx/empresas/2017/03/09/el-metro-de-la-ciudad-de-mexico-tendra-wifi-gratuito-tras-convenio-con-att,Expansión,"EL METRO DE LA CIUDAD DE MÉXICO TENDRÁ WI-FI GRATUITO, TRAS ACUERDO CON AT&T","Un nuevo acuerdo con AT&T permitirá que el Metro de la Ciudad de México ofrezca Wi-Fi gratuito a sus usuarios, mejorando la conectividad en el transporte pblico.","EL METRO DE LA CIUDAD DE MÉXICO TENDRÁ WI-FI GRATUITO, TRAS ACUERDO CON AT&T
 ¿No odias cuando estás viendo tu Facebook y te quedas sin conexión en el metro?
 Tres líneas del metro de la Ciudad de México tendrán Wi-Fi gratuito, a partir de agosto próximo. Esto, como parte de un convenio entre el gobierno de la Ciudad de México y la empresa de telecomunicaciones, AT&T.
 ""Mediante este convenio se desplegará (una) red móvil 4G LTE en las *NUMBER* líneas del STC y se ofrecerá WiFi gratuito en *NUMBER* de ellas para los más de *NUMBER* millones de usuarios que diario transitan en el Metro"", indicó el gobierno capitalino, a través de un comunicado.
 Al inicio, el servicio estará disponible solo en las líneas *NUMBER*, *NUMBER* y *NUMBER* del Sistema de Transporte Colectivo Metro (STCM). Se eligieron estas rutas por ser las de mayor afluencia, con cerca de *NUMBER* pasajeros diarios en cada una.
 Aunque se espera que poco a poco se instale el servicio en las otras líneas y que entre *NUMBER* y *NUMBER* el sistema de transporte esté completamente conectado, de acuerdo con el documento.
 ""El Metro de la Ciudad de México con esto da un salto sustancial y nos estamos colocando a la altura de trenes como los de Moscú, París y Barcelona, de ciudades globales muy importantes"", indicó el jefe del gobierno capitalino, Miguel Ángel Mancera durante el anuncio del nuevo servicio.
 Para dar este servicio se instalarán *NUMBER* puntos de acceso; *NUMBER* equipos de telecomunicaciones; *NUMBER* kilómetros de fibra óptica y *NUMBER* de cable radiante.
 Sin embargo, la Línea *NUMBER*, la más profunda con *NUMBER* metros, representó un reto de diseño e ingeniería, y para la línea *NUMBER* se trabajará con el Instituto Politécnico Nacional (IPN) para resolver un problema tecnológico.
 De acuerdo con el director general del STC, Jorge Gaviño Ambriz, esta última línea utiliza un sistema de pilotaje automático mediante WiFi, lo que podría ocasionar interferencias al colocar otra red inalámbrica.",No Amarillista,Verdadera
49,https://haynoticia.es/primeros-perros-modificados-geneticamente-para-que-no-ladren/?memeo,Hay noticia,Primeros perros modificados genéticamente para que no ladren,"Científicos presentan los primeros perros modificados genéticamente para que no ladren, un avance que podría transformar la convivencia con mascotas en entornos rbanos.","Primeros perros modificados genéticamente para que no ladren
 Una empresa de Arizona (Estados Unidos) ha sacado al mercado los primeros perros de compañía modificados genéticamente para que no puedan ladrar. La empresa, llamada MutedDog, lleva *NUMBER* años estudiando la forma de conseguir perros incapaces de ladrar.
 De momento la empresa comercializa *NUMBER* razas modificadas pero espera que en tan solo *NUMBER* años puedan ofrecer todas las razas. ""Venimos a cubrir una necesidad que muchos usuarios pedían. Ahora cualquiera podrá tener su mascota en casa sin tener que molestar a los vecinos"" explica la empresa en su página web. En principio solo se admiten pedidos en Estados Unidos pero MutedDog ha anunciado la próxima apertura de una sucursal en Barcelona (España) para el próximo mes de Septiembre y planeando abrir en otros países.
 La Asociación Internacional Protectora de Animales (AIPA) ha mostrado su malestar porque no creen que sea ético vender animales mudos modificados genéticamente, aunque la empresa se defiende diciendo que éstos no sufren ya que son mudos desde su nacimiento y no se les hace ninguna operación para que no ladren.",Amarillista,Falsa
50,https://elpais.com/tecnologia/2017/11/03/actualidad/1509698709_439510.html,El País,La caída de WhatsApp afecta a medio mundo,"Una interrupción global de WhatsApp deja a medio mundo sin acceso a la popular aplicación de mensajería, causando inconvenientes y destacando la dependencia tecnológica","La caída de WhatsApp afecta a medio mundo
 Si durante la mañana de este viernes ha observado que no le llegaban mensajes de WhatsApp, entonces es usted uno de los afectados por la caída de este servicio de mensajería móvil. La aplicación móvil de mensajes WhatsApp ha dejado de funcionar en torno a las nueve de la mañana hora peninsular española, un fallo que se ha extendido por varios países de Europa, Asia y América, especialmente en países como España, Reino Unido o Países Bajos, donde los problemas de funcionamiento han sido más acusados. El servicio se ha ido recuperando a partir de las *NUMBER*.
 Las búsquedas web sobre el fallo del servicio de mensajería se han multiplicado en todo el mundo, desde Australia hasta Brasil pasando por Europa. WhatsApp tiene más de mil millones de usuarios activos y es una de las aplicaciones móviles y web más populares de Internet. En España, un estudio de la empresa de tecnología Adglo, especializada en el sector, el *NUMBER*% de los internautas españolas de entre los *NUMBER* y los *NUMBER* años han utilizado la plataforma de mensajería. Por el momento, no hay ningún comunicado desde la empresa sobre este fallo ni en su web si sus redes sociales. Según un experto consultado por EFE, el responsable de la web de seguridad infomática 'Hacking Ético', Deepak Daswani, es más probable que se trate de un fallo técnico que un ataque al servicio, ya que ""apenas han existido problemas de ataques 'hacktivistas' en esta plataforma"".
 Numerosos usuarios han informado de problemas en el servicio de WhatsApp desde la madrugada de este viernes. El problema afecta concretamente al envío de mensajes, lo que visualmente se está representando en los chats a través del icono del reloj que informa de que los mensajes no están siendo enviados, y que a menudo se asocia con problemas de conexión por parte del emisor.
 Por regiones, Europa y el Sudeste Asiático son los territorios que han registrado un mayor número de casos. De acuerdo con datos del portal Outage Report, Reino Unido, Italia y la India son los tres países más afectados por esta interrupción del servicio de WhatsApp, mientras España ocupa el noveno puesto en la lista de mayor incidencia del problema, con más de un centenar de casos informados a través del citado portal y con especial efecto en ciudades muy pobladas como Madrid, Barcelona, Valencia o Sevilla.
 Se trata de la segunda gran caída que afecta a un servicio que forma parte de la matriz propiedad de Mark Zuckerberg en el último mes. El pasado *NUMBER* de octubre, las redes sociales Facebook e Instagram también experimentaron sendos problemas de funcionamiento que impedían acceder a sus plataformas.",No Amarillista,Verdadera
51,http://www.elmundotoday.com/2017/09/la-cnn-utiliza-imagenes-de-murcia-para-mostrar-la-devastacion-del-huracan-irma/,El mundo today,La CNN utiliza imágenes de Murcia para mostrar la devastación del huracán Irma,"En una polémica decisión, CNN utiliza imágenes de Murcia para ilustrar los efectos devastadores del huracán Irma, generando críticas y cuestionamientos sobre la ética priodística.","La CNN utiliza imágenes de Murcia para mostrar la devastación del huracán Irma
 EL ALCALDE DE LA CIUDAD, ORGULLOSO DE QUE MURCIA ""ESTÉ EN EL FOCO INTERNACIONAL""
 Ante la dificultad de tomar buenas fotografías en las zonas del Caribe afectadas, con algunas rachas de viento que alcanzan los 350km/h, la CNN ha decidido utilizar imágenes de Murcia, concretamente de un descampado del barrio de Espinardo, para mostrar la devastación del huracán Irma.
 ""El terreno árido, seco y escarpado de esta localidad es perfecto para exponer las terribles consecuencias de un ciclón tropical"", asegura Phillip Wilson, director de informativos de la cadena estadounidense. ""Murcia es como el después de una terrible catástrofe pero con unas condiciones favorables para grabar imágenes"", se sincera.
 El alcalde de la ciudad, José Ballesta, destaca ""el orgullo de haber situado esta región en el foco de los medios internacionales"", añadiendo que ""si esto no es Marca España, ya me dirán ustedes qué es"". Asegura que el objetivo para el próximo huracán es ""que se decidan a bautizarlo con el nombre de Murcia, o mejor aún, lograr un buen patrocinio y que se le conozca como Huracán Murcia Estrella Levante"".
 El equipo de informativos de la CNN desplazado a Murcia también ha querido fotografiar a varios habitantes de la zona para ilustrar los rostros del horror de la tragedia. ""Su hostilidad, su sufrimiento y su manera de hablar sin duda transmiten al espectador la sensación de que algo espantoso les ha pasado"", explican los periodistas.
 No es la primera vez que los estadounidenses piensan en Murcia para documentar un hecho histórico: en el año *NUMBER*, un equipo de la NASA ya se desplazó a esta comunidad autónoma para fingir la llegada del hombre a la Luna.",No Amarillista,Falsa
