Id,Link,Source,Titular,Copete,Cuerpo,Amarillismo,Falsa
52,https://www.unocero.com/noticias/explota-la-bateria-de-un-iphone-dentro-de-una-apple-store/amp/,Uno Cero,Explota la batería de un iPhone dentro de una Apple Store,"Una batería de iPhone explota dentro de una Apple Store, provocando una evacuación y planteando preocupaciones sobre la seguridad de los dispositivos electrónicos","Explota la batería de un iPhone dentro de una Apple Store
 Según mencionan fuentes locales, el día de ayer explotó la batería de un iPhone dentro de la Apple Store de la calle Colón en Valencia, España, lo que provocó pánico entre los clientes y la intervención del cuerpo de policías y bomberos de la ciudad.
 La misma fuente indica que después de la fuerte explosión toda la planta superior se llenó de humo, lo que obligó a clientes y empleados a evacuar la tienda, pero afortunadamente no hubo heridos de ningún tipo.
 El personal de la Apple Store siguió todos los protocolos de seguridad, y según relatan los testigos, los empleados del lugar abrieron las ventanas y echaron tierra encima de la batería para ahogar el fuego, aunque el sistema contra incendios de la tienda también se activó con éxito.
 Desafortunadamente para Apple, sucedió exactamente el mismo caso en Zurich, Suiza, pues la Apple Store ubicada en Bahnhofstrasse también reportó la explosión de una batería de iPhone, lo que provocó heridas menores a siete personas, entre ellas una empleada que sufrió quemaduras al tratar de sofocar el fuego.
 Hasta el momento Apple no ha emitido un comunicado oficial, y desafortunadamente aún no hay información sobre los modelos de iPhone cuyas baterías explotaron, pero debemos recordar que hace unos meses varios usuarios reportaron que algunas de las baterías del iPhone *NUMBER* y *NUMBER* Plus se inflaban al conectar el dispositivo a la corriente eléctrica, lo que podría ocasionar una explosión de la batería de ion litio.",No Amarillista,Falsa
53,https://haynoticia.es/movistar-vodafone-orange-bloquearan-los-torrents-partir-mayo/,Hay noticia,"Movistar, Vodafone y Orange bloquearan los torrents a partir de mayo","Las principales compañías de telecomunicaciones, Movistar, Vodafone y Orange, anuncian que bloquearán el acceso a torrents a partir de mayo, afectando a los usuaros de estos servicios.","Movistar, Vodafone y Orange bloquearan los torrents a partir de mayo
 Se acabó lo que se daba. Los grandes operadores de telecomunicaciones de este país se han puesto de acuerdo y a raíz de las peticiones de la SGAE, sumadas a las de los gigantes del mundo de la música como SONY o UNIVERSAL han decidido que ha llegado la hora de oír sus reclamaciones y poner fin a las descargas de torrents.
 De esta forma se filtrará todo el tráfico de internet de todos los usuarios, se identificarán los paquetes de datos torrent y se bloquearán inmediatamente, enviando además un mensaje al usuario de que los archivos que intentan bajar están protegidos por copyright y que en caso de reincidir el servicio podría ser cortado temporal o indefinidamente.
 La Asociación de Internautas Españoles promete dar guerra en los próximos días con hashtags y memes de todo tipo, para intentar frenar esta ""vulnerabilidad flagrante y evidente del derecho constitucional a bajarse el disco que uno quiera y comprarlo solo si la economía se lo permite""",No Amarillista,Falsa
54,http://www.elfinanciero.com.mx/empresas/hi5-quiere-convertirse-en-el-nuevo-tinder,El financiero,Hi5 quiere convertirse en el nuevo Tinder,"Hi5 busca reinventarse y convertirse en el nuevo Tinder, enfocándose en el mercado de citas en línea y atrayendo a usuarios que buscan nuevas plataformas para conocer personas","Hi5 quiere convertirse en el nuevo Tinder
 La red social Hi5, fundada en *NUMBER* y que fue muy popular hace más de una década entre los jóvenes, cambió y ahora tiene una estrategia muy similar a la de Tinder, la popular aplicación de encuentros.
 Hi5 vende paquetes de *NUMBER* dólares mensuales, *NUMBER* trimestrales u *NUMBER* dólares semestrales. Con ello puedes conocer la lista de quienes gustan de ti; los que miran tu perfil; acceder a personas populares y contactar nuevos usuarios, como una forma de buscar relacionarte.
 De acuerdo con datos de Statista al mes de abril de *NUMBER*, Facebook tiene un alcance de *NUMBER* por ciento en redes sociales, muy por encima del *NUMBER* por ciento que ostenta Hi5, la suma supera al *NUMBER* por ciento porque muchas personas tienen más de una cuenta en redes sociales.
 Para Efrén Páez, analista de Mediatelecom, no es sorpresiva la evolución de Hi5, pues al no atender el universo de usuarios de redes sociales como una aplicación, buscó un nicho especializado para ser más rentable.
 ""Muchas veces los usuarios son los que dictan cómo se debe llevar una red social, incluso, es posible que los desarrolladores hayan visto una oportunidad de negocio de esa manera, pues al encontrar un nicho les abre un mercado de redes en origen parecidas a Facebook, que no pueden cubrir"", agregó.
 Hi5 fue tan popular, que incluso en *NUMBER* Televisa invirtió en ella alrededor de *NUMBER* millones de dólares.",Amarillista,Verdadera
55,https://www.nacion.com/archivo/los-mamiferos-aparecieron-despues-de-la-extincion-de-los-dinosaurios/2VT6KQL2NJHDHCG3HJZ5G2OZJ4/story/,La Nacion,Los mamiferos aparecieron después de la extinción de los dinosaurios,"Un estudio confirma que los mamíferos surgieron después de la extinción de los dinosaurios, arrojando luz sobre la evolución y adaptación de las especies tras eventos catastróicos.","Los mamiferos aparecieron después de la extinción de los dinosaurios
 El ancestro común a todos los mamíferos placentarios como el hombre, el caballo, el perro, el mono o la ballena apareció tras la extinción de los dinosaurios hace *NUMBER* millones de años, según muestra una investigación internacional publicada este jueves.
 Este estudio resuelve el debate sobre los orígenes de los mamíferos, que trabajos precedentes situaban antes de la desaparición de los dinosaurios y del *NUMBER*% de las especies del planeta que habría sido causada, según la teoría más comúnmente aceptada, por el impacto de un asteroide que revolucionó el clima.
 Para llegar a esta conclusión, los investigadores se apoyaron en el mayor banco de datos del mundo donde cotejaron los rasgos genéticos y morfológicos de las diferentes especies para reconstruir el árbol genealógico de los mamíferos placentarios, la rama más importante de esta familia que cuenta con más de *NUMBER* especies vivas.
 Sin embargo, análisis genéticos previos habían hecho pensar que los mamíferos eran ya un grupo diversificado al final del período Cretácico.
 A partir de ahora, se estima que su surgimiento se situó entre *NUMBER* y *NUMBER* años después de la desaparición de los dinosaurios.
 ""Es alrededor de *NUMBER* millones de años más tarde que las estimaciones basadas solamente en los datos genéticos"", subraya Marcelo Weksler, paleontólogo del Museo Nacional-UFRJ de Brasil y uno de los *NUMBER* coautores del estudio publicado en la revista estadounidense Science con fecha del *NUMBER* de febrero.
 Para remontarse hasta el ancestro común de los mamíferos, un animal que habría sido del tamaño de una pequeña rata, estos científicos desgranaron las características físicas y genéticas de *NUMBER* especies, *NUMBER* de ellas ya extinguidas pero conocidas gracias a los fósiles.
 En el proceso reunieron *NUMBER* características morfológicas como la presencia o la ausencia de alas, de dientes y de ciertos tipos de esqueletos, y después las combinaron con datos genéticos.
 Este banco de datos contiene diez veces más informaciones que las utilizadas hasta el momento para estudiar la historia de los mamíferos, según subrayan los investigadores, al tiempo que precisan que se encuentra accesible al público en Internet, en el sitio *URL* que cuenta con más de *NUMBER* ilustraciones.",No Amarillista,Verdadera
56,http://lavozpopular.com/papa-francisco-anuncia-app-ligar-iglesia/,La voz popular,PAPA FRANCISCO ANUNCIA LANZAMIENTO DE APP PARA LIGAR EN LA IGLESIA: HOLY MATCH,"El Papa Francisco sorprende al anunciar el lanzamiento de Holy Match, una aplicación de citas diseñada para ayudar a los fieles a encontrar pareja dentro de la comunidad religiosa","PAPA FRANCISCO ANUNCIA LANZAMIENTO DE APP PARA LIGAR EN LA IGLESIA: HOLY MATCH
 Holy Match es el nombre que tendrá la nueva app móvil que, antes de salir al mercado ya está haciendo mucho ruido y llamando la atención de creyentes y no creyentes.
 La app Holy Match permitirá a seguidores de la religión católica conocerse e iniciar relaciones sentimentales, con el motivo a su vez de aumentar la asistencia de jóvenes cristianos a las iglesias.
 El Tinder católico
 Esta aplicación móvil que ha anunciado públicamente el Papa Francisco en El Vaticano el pasado *NUMBER* de diciembre tiene funcionalidades muy similares al Tinder. Con mover el dedo hacia derecha o izquierda, mandas a las personas que te van apareciendo (según geolocalización) al ""cielo"" o al ""infierno"", siendo el cielo el equivalente al Like.
 El Holy Match sucede cuando dos personas se han mandado al cielo mutuamente. Cuando esto sucede, no se inicia un chat directamente, sino que deben acordar una de las opciones de iglesias cercanas y horarios de misas para quedar.
 La parte clave es que las iglesias también tendrán información sobre las ""citas"" que sucederán durante sus ceremonias, para poder aplicar estrategias que ""enganchen"" a estos nuevos visitantes.
 Críticas y elogios a partes iguales
 A los más conservadores, les parece que Jorge Bergoglio está apoyando ideas demasiado ""radicales"" y que se salen de lo esperado de un Papa, mientras que muchos otros consideran que está modernizando la religión y trabajando para recuperar la Fe en los jóvenes haciéndolos asistir a misas antes de ligar.
 La app estará disponible en el primer trimestre de *NUMBER*, tanto en Android como iOS y tendrá un coste equivalente a lo que cada quien dejaría como ofrenda tras una misa. Dejaremos aquí los enlaces para descarga en cuanto se publique.
 ¿Y tú?¿Qué opinas de esta app?",Amarillista,Falsa
57,https://www.publimetro.cl/cl/mundo/2016/10/05/tendremos-otra-hielo-2019-segun-cientificos.html,Publimetro,Tendremos otra Era de Hielo en *NUMBER* según los científicos,"Científicos advierten sobre la posibilidad de una nueva Era de Hielo en un futuro cercano, basada en patrones climáticos y estudios geológicos recientes","Tendremos otra Era de Hielo en *NUMBER* según los científicos
 Ayer, imágenes de la NASA revelaron que las manchas solares habían desaparecido, dejándolo en blanco. Pero, por cuarta vez en este año, la cara del Sol aparecía lisa. Esto significa que, probablemente que el planeta está a punto de entrar en otra fase larga de frío.
 De esta manera, el Sol ha estado en su periodo más tranquilo, durante más de un siglo. Normalmente, la actividad de las manchas solares oscila entre *NUMBER* o *NUMBER* años, pero esta está disminuyendo más rápidamente que en cualquier momento de los últimos *NUMBER* mil años.
 Esto solo pasó desde el siglo XV y su punto más álgido fue desde *NUMBER* hasta *NUMBER*. El río Támesis de Londres se congeló. Hubo hambre generalizada debido a las malas cosechas. Esto se conoció como el Mínimo de Maunder. Esto coincidió con la parte más fría de la ""Pequeña Edad de Hielo"". Pasó de los siglos XV al XVII. Europa, América del Norte y el resto del mundo sufrieron inviernos muy crudos.
 Todavía no se sabe si hay una conexión entre la baja actividad de las manchas solares y los inviernos fríos, pero se cree que la variación solar es parte del cambio climático y tiene más incidencia que el Calentamiento global.
 En *NUMBER*-*NUMBER*, se verá esta actividad en su punto más bajo.
 ¿Qué ha pasado y qué pasará?
 De acuerdo con Paul Dorian, meteorólogo en Vencore Weather, El sol ya ha estado completamente en blanco este año y esto se vio a partir del *NUMBER* de junio. Fue la primera vez que ocurrió desde *NUMBER*.
 Pero, esto solo indicaría que va para una nueva fase. Y duraría meses. Ahora bien, el viento solar disminuye y el campo magnético del Sol se debilita durante los mínimos solares, por lo que es más fácil que los rayos cósmicos lleguen a la Tierra.
 Asimismo, para los astronautas sería muy peligroso, ya que el aumento de los rayos cósmicos pueden romper fácilmente una cadena de ADN, reportó el portal ""Elite Daily"".
 No hay tantas manchas en el Sol. Esto llegará a su punto más bajo en tres años. Esto se reflejará en otra mini Era de Hielo que causará crudos inviernos.",Amarillista,Falsa
58,https://www.eldizque.com/anuncia-facebook-que-ahora-solo-aceptara-un-numero-limitado-de-selfies-por-dia/,El Dizque,Anuncia Facebook que ahora sólo aceptará un número limitado de selfies por día,"Facebook implementa una nueva política que limitará la cantidad de selfies que los usuarios pueden subir por día, en un intento por fomentar contenido ms variado.","Anuncia Facebook que ahora sólo aceptará un número limitado de selfies por día
 Mark Zuckerberg, dueño y amo del universo (de Facebook), anunció el día de hoy que, debido al abuso que algunos usuarios hacen de los selfies, se establecerá un límite para los mismos, de modo que no se saturen los servidores, algo que está pasando con demasiada frecuencia.
 Según las estadísticas presentadas, son mujeres las que más fotografías de este tipo suben a Facebook (*NUMBER* de cada *NUMBER*). Y lo aterrador es que México ocupa el primer lugar en el pastel, con un escandaloso *NUMBER*% del total.
 A partir de ahora, el número de selfies que el usuario podrá subir será de un máximo de *NUMBER* al día, y el sistema bloqueará cualquier intento de subir selfies una vez sobrepasado ese límite. A la medianoche de cada día, el contador se reseteará, y así las personas podrán volver a subir selfies.
 Sin embargo, el sistema llevará un conteo de las veces que el usuario trate de subir la selfie #*NUMBER*, es decir, después de alcanzar su límite diario. En caso de llegar a *NUMBER* intentos, la cuenta será eliminada definitivamente.
 ""Facebook intenta darle las facilidades a los usuarios para compartir sus experiencias"", declaró el joven Zuckerberg. ""Pero ya se están pasando. Y pues nos ponen en la penosa necesidad de tomar medidas como ésta"".
 También se mencionó un filtro de vital importancia. De hoy en adelante, y para evitar engaños, Facebook exigirá a sus usuarios una fotografía de cuerpo entero para validar que la selfie no esté truqueada, buscando aparentar algo que no son. De igual manera, Adobe se ha subido al barco antiselfie y está desarrollando un software para trackear fotografías alteradas con copias piratas de Photoshop.",Amarillista,Falsa
59,https://www.eldizque.com/el-shampoo-sera-el-alimento-del-futuro-aseguran-expertos/,El Dizque,"El shampoo será el alimento del futuro, aseguran expertos","Expertos en nutrición predicen que el shampoo podría convertirse en un alimento del futuro, revolucionando la manera en que consumimos productos de cuidado personl.","El shampoo será el alimento del futuro, aseguran expertos
 Con el tiempo, los seres humanos nos hemos ido acabando los recursos naturales del planeta, razón por la cual, poco a poco se comienza a gestar una crisis alimentaria que parece se podría convertir en algo muy grave.
 Ya no hay comida, aseguran los expertos, pues somos tantas personas en el mundo que no alcanza ya para todos, de ahí que muchas zonas poco privilegiadas en cuanto a acceso y condiciones sean catalogadas como zonas en extrema pobreza donde la población no tiene nada para comer.
 Ante ello, las empresas Unilever y Procter & Gamble han levantado la mano y prometen unir esfuerzos para que esas comunidades y el planeta entero ya no sufra de hambre, promoviendo que el shampoo sea utilizado como alimento, porque además, han descubierto que es muy benéfico para la salud.
 ""Y es que mire usted"", dijo Ciriaco A. Wilson, representante de P&G. ""Si toma una botella de shampoo, verá que está hecho de extractos de productos naturales como frutas, semillas, con vitaminas, minerales, proteinas, y además huelen bonito, esto podrá hacer que además de servir como alimento, nadie sufra de mal aliento"".
 El señor Wilson afirmó que sólo nos falta darle un mejor sabor, y entonces sí, el shampoo podrá ser utilizado para consumo humano y con ello, el hambre en el planeta se acabará.",Amarillista,Falsa
60,http://lavozpopular.com/whatsapp-incluira-la-bandera-daesh-proxima-actualizacion/,La voz popular,WHATSAPP INCLUIRÁ LA BANDERA DE DAESH EN SU PRÓXIMA ACTUALIZACIÓN,"En una controvertida decisión, WhatsApp anuncia que incluirá la bandera de Daesh en su próxima actualización, generando indignación y preocupaciones sobre la moderaión de contenidos.","WHATSAPP INCLUIRÁ LA BANDERA DE DAESH EN SU PRÓXIMA ACTUALIZACIÓN
 La bandera de Catalunya también estará en WhatsApp
 Durante las últimas actualizaciones de WhatsApp, la aplicación de mensajería más usada del planeta ha incluido una gran cantidad de emojis (o emoticonos) nuevos, de todo tipo. Y aunque los emojis no depende directamente de WhatsApp, sino del Consorcio UNICODE, es la aplicación de mensajería la que tiene la última palabra a la hora de añadir o retirar alguna.
 Ahora se han filtrado imágenes de la próxima actualización de WhatsApp que trae nuevos emojis, y entre las novedades destacan las banderas de DAESH y de Cataluña.
 Entre los nuevos iconos de WhatsApp destacan los iconos multirraciales, en los cuáles, casi cualquier parte humana tiene su versión con unos rasgos raciales u otros.
 Más iconos nuevos además de la bandera de ISIS podremos encontrar, desde una curiosa sonrisa invertida a nuevas frutas o gestos. Bajo estas líneas algunos ejemplos de los nuevos emojis que WhatsApp ya lanzó en *NUMBER*.
 Iconos de banderas en WhatsApp
 Banderas en WhatsApp hay muchas, y ya son varios los conflictos que se han originado en este ámbito en el contexto de las apps para smartphone. Hace unos meses, unos estudiantes catalanes crearon una app para smartphone que era capaz de sustituir el emoji de la bandera de España por el de la estelada catalana, era la EstelApp.
 En España, se están recogiendo firmas para que el Consorcio UNICODE incluya la bandera republicana española en WhatsApp.
 Por otro lado, un gran revuelo incendió Argentina cuando se incluyó el icono de las Malvinas, como territorio británico, en la última actualización de WhatsApp.
 Para evitar incidentes de este tipo, o para al menos establecer una política clara a respecto de los emojis de banderas, WhatsApp cuenta desde *NUMBER* con un equipo asesor en materia de vexilología que ayuda al director de producto a decidir qué banderas incorporar y que no.
 Lo cierto es que hasta que WhatsApp no libere la nueva versión no sabremos si finalmente se ha incluido o no la bandera del Estado Islámico, el cuál, recordemos, no ha sido reconocido como estado.",No Amarillista,Falsa
61,http://www.bbc.com/mundo/ultimas_noticias/2014/03/140305_ultnot_rayos_terremotos_men,BBC News,Explican por qué aparecen destellos de luz antes de un terremoto,"Científicos explican el fenómeno de los destellos de luz que se observan antes de un terremoto, ofreciendo nuevas perspectivas sobre los indicadores sísmicos","Explican por qué aparecen destellos de luz antes de un terremoto
 Mucho se ha discutido sobre los que sucede antes de un terremoto: cambios en la atmósfera, temperaturas anormales, animales inquietos, misteriosos destellos.
 Algunos de estos eventos suenan como leyendas y mitos urbanos pero un estudio científico parece haber encontrado la explicación de las misteriosas luces que a veces aparecen poco antes de un sismo.
 Según investigadores de la Universidad Rutgers, en Estados Unidos, los destellos lumínicos se producen debido a que los deslizamientos del suelo cerca de las fallas geológicas de la Tierra generan una carga eléctrica.
 Se conocen como ""luces de terremoto"" y han sido documentadas desde los años *NUMBER*, dice un informe de la Asociación Sismológica de Estados Unidos.
 Dos días antes del terremoto de San Francisco de *NUMBER*, por ejemplo, una pareja vio rayos de luz a lo largo del suelo. Y en el caso de Quebec, Canadá, en *NUMBER*, un brillante globo de luz rosa y púrpura se avistó *NUMBER* días antes del devastador temblor.
 En el caso del sismo de L'Aquila, Italia, en *NUMBER*, transeúntes vieron ""llamas de luz"" saliendo de los adoquines en el sector histórico de la ciudad segundos antes del mismo.
 Y evidencias en video de numerosos rayos de luz fueron registradas por cámaras de seguridad durante el terremoto de magnitud *NUMBER* en Pisco, Perú, en *NUMBER*.
 Más recientemente, varios videos que muestran esferas luminosas fueron publicados en YouTube, en el marco del terremoto y tsunami de Fukushima, Japón, en *NUMBER*.
 Estas luces de terremoto se pueden producir antes o durante los movimientos sísmicos.
 Los rayos más habituales en el cielo son el resultado de una acumulación de carga eléctrica en las nubes.
 Pero los experimentos de laboratorio en la Universidad de Rutgers sugieren que estas luces se originan, en cambio, por el gran aumento de carga eléctrica en el suelo cuando la tierra se rompe.
 Carga eléctrica
 Los resultados fueron presentados en la reunión de la Sociedad Estadounidense de Física, en *NUMBER*, por el ingeniero biomédico troy Shinbrot.
 Su laboratorio creó un modelo miniatura de las tensiones, forcejeo y rupturas que suceden durante un terremoto.
 Llenaron tanques con diferentes tipos de granos, desde harina hasta finas bolitas de vidrio, y las agitaron de manera intermitente para crear grietas.
 Observaron que esto generaba cientos de voltios de electricidad, lo que sugiere que incluso sutiles deslizamientos del suelo en las fallas geológicas son suficientes para cargar la Tierra y provocar rayos en el cielo.
 El equipo liderado por Troy Shinbrot observó también otros dos tipos de materiales con partículas que se unen y deslizan de forma similar a como lo hace la Tierra en las zonas más propensas a los sismos.
 Así descubrieron que, al ser movidos, todos desarrollan un voltaje eléctrico.
 Aún no han podido averiguar por qué se produce esta carga ni por qué algunas veces aparecen las luces y otras no.
 ""No todo gran terremoto está precedido por rayos. Ni después de todos los rayos que se dan en un cielo despejado son seguidos de un terremoto"", comentó Shinbrot.
 ""Hemos encontrado que parecen ser los precursores de algunos grandes terremotos, de magnitud *NUMBER* o mayores. Pero la señal del voltaje no es siempre la misma. Algunas veces es alta y otras baja"", añadió.
 No obstante, estas señales de advertencia luminosas podrían ayudar a prevenir desastres.
 En el caso del terremoto en L'Aquila, se informó de un residente que, después de ver los destellos dentro de su casa, dos horas antes del sismo, sacó a su familia a un sitio seguro.
 A partir de esto, se han iniciado proyectos para observar y registrar estas luces en zonas especialmente vulnerables a los movimientos sísmicos.",No Amarillista,Verdadera
62,https://www.forbes.com.mx/eva-el-futuro-de-la-produccion-en-alimentos/,Forbes,"EVA, el futuro de la producción en alimentos","EVA, una innovadora tecnología, promete revolucionar la producción de alimentos, mejorando la eficiencia y sostenibilidad en la industria alimentaria global","EVA, el futuro de la producción en alimentos
 Una de las principales empresas productoras y exportadoras de legumbres se encuentra en San Francisco del Rincón, Guanajuato. Grupo Altex produce cerca de *NUMBER* millones de lechugas hidropónicas al año con un ahorro de *NUMBER*% de agua, técnica que promete ser el futuro de la alimentación para las grandes ciudades en el mundo.",Amarillista,Verdadera
